{
  "snapshotId": "SNAPSHOT-AMZ-ADS-M1B",
  "version": "0.2.0",
  "objectIds": [
    "SRC-PORTFOLIO-PERFORMANCE-SYNTHETIC",
    "SRCREV-PORTFOLIO-PERFORMANCE-SYNTHETIC-V1",
    "ELEM-PORTFOLIO-PERFORMANCE-SYNTHETIC-0A16375A81",
    "ELEM-PORTFOLIO-PERFORMANCE-SYNTHETIC-F432B14089",
    "ELEM-PORTFOLIO-PERFORMANCE-SYNTHETIC-2B1F2878C1",
    "SRC-METRIC-DEFINITION-SYNTHETIC",
    "SRCREV-METRIC-DEFINITION-SYNTHETIC-V1",
    "ELEM-METRIC-DEFINITION-SYNTHETIC-15C3B076B7",
    "ELEM-METRIC-DEFINITION-SYNTHETIC-0F280752F7",
    "SRC-DIAGNOSTIC-BRIEF-SYNTHETIC",
    "SRCREV-DIAGNOSTIC-BRIEF-SYNTHETIC-V1",
    "ELEM-DIAGNOSTIC-BRIEF-SYNTHETIC-67617D3257",
    "ELEM-DIAGNOSTIC-BRIEF-SYNTHETIC-EC223962FF",
    "ELEM-DIAGNOSTIC-BRIEF-SYNTHETIC-342DD49780",
    "ELEM-DIAGNOSTIC-BRIEF-SYNTHETIC-11E9B09E72",
    "ELEM-DIAGNOSTIC-BRIEF-SYNTHETIC-0DD385FB1B",
    "ELEM-DIAGNOSTIC-BRIEF-SYNTHETIC-2E62CE6487",
    "ELEM-DIAGNOSTIC-BRIEF-SYNTHETIC-2365417183",
    "ELEM-DIAGNOSTIC-BRIEF-SYNTHETIC-3EED3CFA78",
    "ELEM-DIAGNOSTIC-BRIEF-SYNTHETIC-7ACC851463",
    "ELEM-DIAGNOSTIC-BRIEF-SYNTHETIC-25FC7281AD",
    "ELEM-DIAGNOSTIC-BRIEF-SYNTHETIC-69D6CF129A",
    "ELEM-DIAGNOSTIC-BRIEF-SYNTHETIC-099992CB8A",
    "ELEM-DIAGNOSTIC-BRIEF-SYNTHETIC-5EB733426B",
    "ELEM-DIAGNOSTIC-BRIEF-SYNTHETIC-5E448356B2",
    "ELEM-DIAGNOSTIC-BRIEF-SYNTHETIC-D1DA95DD81",
    "ELEM-DIAGNOSTIC-BRIEF-SYNTHETIC-20FA1C20C2",
    "ELEM-DIAGNOSTIC-BRIEF-SYNTHETIC-C9F2978EC2",
    "ELEM-DIAGNOSTIC-BRIEF-SYNTHETIC-0F2199EEC7",
    "SRC-OPERATING-PLAYBOOK-SYNTHETIC",
    "SRCREV-OPERATING-PLAYBOOK-SYNTHETIC-V1",
    "ELEM-OPERATING-PLAYBOOK-SYNTHETIC-9E79C5541D",
    "ELEM-OPERATING-PLAYBOOK-SYNTHETIC-DBABED8BFD",
    "ELEM-OPERATING-PLAYBOOK-SYNTHETIC-7D7F4C0713",
    "ELEM-OPERATING-PLAYBOOK-SYNTHETIC-0C3A3BE56A",
    "ELEM-OPERATING-PLAYBOOK-SYNTHETIC-02FBC413CD",
    "ELEM-OPERATING-PLAYBOOK-SYNTHETIC-46C24504DC",
    "ELEM-OPERATING-PLAYBOOK-SYNTHETIC-1E1B8F3487",
    "ELEM-OPERATING-PLAYBOOK-SYNTHETIC-B6AB3DAF66",
    "ELEM-OPERATING-PLAYBOOK-SYNTHETIC-C07052CAB4",
    "ELEM-OPERATING-PLAYBOOK-SYNTHETIC-EFF2AEC1BC",
    "ELEM-OPERATING-PLAYBOOK-SYNTHETIC-BEBAF5BA51",
    "ELEM-OPERATING-PLAYBOOK-SYNTHETIC-9D3D685660",
    "ELEM-OPERATING-PLAYBOOK-SYNTHETIC-BC335A2258",
    "ELEM-OPERATING-PLAYBOOK-SYNTHETIC-295A6EDCC7",
    "ELEM-OPERATING-PLAYBOOK-SYNTHETIC-12A8E8037E",
    "ELEM-OPERATING-PLAYBOOK-SYNTHETIC-1B62F3C05C",
    "ELEM-OPERATING-PLAYBOOK-SYNTHETIC-1208B607DD",
    "ELEM-OPERATING-PLAYBOOK-SYNTHETIC-5D6EF936A7",
    "ELEM-OPERATING-PLAYBOOK-SYNTHETIC-438AFECEF4",
    "ELEM-OPERATING-PLAYBOOK-SYNTHETIC-11D2661228",
    "ELEM-OPERATING-PLAYBOOK-SYNTHETIC-48570BA8C7",
    "ELEM-OPERATING-PLAYBOOK-SYNTHETIC-26A8CEF50A",
    "ELEM-OPERATING-PLAYBOOK-SYNTHETIC-E6B556D443",
    "ELEM-OPERATING-PLAYBOOK-SYNTHETIC-F611ECF6ED",
    "ELEM-OPERATING-PLAYBOOK-SYNTHETIC-63D74D88AC",
    "ELEM-OPERATING-PLAYBOOK-SYNTHETIC-A57D0BE2D8",
    "ELEM-OPERATING-PLAYBOOK-SYNTHETIC-E065FF5020",
    "ELEM-OPERATING-PLAYBOOK-SYNTHETIC-530C783AAD",
    "ELEM-OPERATING-PLAYBOOK-SYNTHETIC-BD710DF611",
    "ELEM-OPERATING-PLAYBOOK-SYNTHETIC-39B894C5B8",
    "ELEM-OPERATING-PLAYBOOK-SYNTHETIC-F46A0A1DA7",
    "ELEM-OPERATING-PLAYBOOK-SYNTHETIC-A60D612A6D",
    "ELEM-OPERATING-PLAYBOOK-SYNTHETIC-E9C5228EC5",
    "ELEM-OPERATING-PLAYBOOK-SYNTHETIC-6E6CEA6123",
    "ELEM-OPERATING-PLAYBOOK-SYNTHETIC-495DD97D9C",
    "ELEM-OPERATING-PLAYBOOK-SYNTHETIC-98442C2414",
    "ELEM-OPERATING-PLAYBOOK-SYNTHETIC-E30BF63391",
    "ELEM-OPERATING-PLAYBOOK-SYNTHETIC-499E4D9027",
    "ELEM-OPERATING-PLAYBOOK-SYNTHETIC-2F3947B577",
    "ELEM-OPERATING-PLAYBOOK-SYNTHETIC-9BF6688B4B",
    "ELEM-OPERATING-PLAYBOOK-SYNTHETIC-D8957F587E",
    "ELEM-OPERATING-PLAYBOOK-SYNTHETIC-096B372670",
    "ELEM-OPERATING-PLAYBOOK-SYNTHETIC-003BACBE5C",
    "ELEM-OPERATING-PLAYBOOK-SYNTHETIC-CE5315ED52",
    "SRC-DIAGNOSIS-NOTES-SYNTHETIC",
    "SRCREV-DIAGNOSIS-NOTES-SYNTHETIC-V1",
    "ELEM-DIAGNOSIS-NOTES-SYNTHETIC-DB6F3559A6",
    "ELEM-DIAGNOSIS-NOTES-SYNTHETIC-6E60BE8837",
    "ELEM-DIAGNOSIS-NOTES-SYNTHETIC-128BA65678",
    "ELEM-DIAGNOSIS-NOTES-SYNTHETIC-A575092A56",
    "ELEM-DIAGNOSIS-NOTES-SYNTHETIC-DB6C07D574",
    "ELEM-DIAGNOSIS-NOTES-SYNTHETIC-3D44E3C49B",
    "ELEM-DIAGNOSIS-NOTES-SYNTHETIC-49A32478D1",
    "ELEM-DIAGNOSIS-NOTES-SYNTHETIC-DD978A374E",
    "ELEM-DIAGNOSIS-NOTES-SYNTHETIC-07B2FAD7EA",
    "ELEM-DIAGNOSIS-NOTES-SYNTHETIC-96234519D0",
    "SRC-ACCOUNT-CONTEXT-SYNTHETIC",
    "SRCREV-ACCOUNT-CONTEXT-SYNTHETIC-V1",
    "ELEM-ACCOUNT-CONTEXT-SYNTHETIC-2FB264F5E1",
    "ELEM-ACCOUNT-CONTEXT-SYNTHETIC-8A8733A915",
    "ELEM-ACCOUNT-CONTEXT-SYNTHETIC-AD4ADFAF55",
    "ELEM-ACCOUNT-CONTEXT-SYNTHETIC-54F56C5870",
    "ELEM-ACCOUNT-CONTEXT-SYNTHETIC-606AF0A98A",
    "ELEM-ACCOUNT-CONTEXT-SYNTHETIC-C6E7A59372",
    "ELEM-ACCOUNT-CONTEXT-SYNTHETIC-BBA670D734",
    "ELEM-ACCOUNT-CONTEXT-SYNTHETIC-8B0FFD58BF",
    "ELEM-ACCOUNT-CONTEXT-SYNTHETIC-42F029F7E6",
    "ELEM-ACCOUNT-CONTEXT-SYNTHETIC-4CB5182AE5",
    "ELEM-ACCOUNT-CONTEXT-SYNTHETIC-A553ACB57C",
    "EVID-AMZ-ACOS-DELTA",
    "EVID-AMZ-ACOS-DEFINITION",
    "EVID-AMZ-EVIDENCE-GATE",
    "CLAIM-AMZ-ACOS-RISING",
    "CONCEPT-AMZ-ACOS",
    "METRIC-AMZ-ACOS",
    "DECISION-AMZ-ACOS-DIAGNOSIS",
    "CASE-AMZ-ACOS-SYNTHETIC",
    "PLAYBOOK-AMZ-ACOS-CHECK",
    "SKILL-AMZ-ADS-DIAGNOSIS-V1",
    "TASK-AMZ-ADS-DIAGNOSIS-V1",
    "POLICY-MKD-SYNTHETIC-LABEL",
    "PERMISSION-AMZ-ADS-E2",
    "PROMOTION-AMZ-ADS-DIAGNOSIS-V1",
    "OWNERSHIP-AMZ-ADS-DIAGNOSIS-V1",
    "ACCEPTANCE-AMZ-ADS-DIAGNOSIS-V1",
    "FRESHNESS-AMZ-ADS-30D",
    "EVAL-AMZ-ADS-DIAGNOSIS-V1",
    "GOLDEN-AMZ-ADS-POSITIVE-01",
    "GOLDEN-AMZ-ADS-POSITIVE-02",
    "GOLDEN-AMZ-ADS-POSITIVE-03",
    "GOLDEN-AMZ-ADS-POSITIVE-04",
    "GOLDEN-AMZ-ADS-POSITIVE-05",
    "GOLDEN-AMZ-ADS-POSITIVE-06",
    "GOLDEN-AMZ-ADS-POSITIVE-07",
    "GOLDEN-AMZ-ADS-POSITIVE-08",
    "GOLDEN-AMZ-ADS-NEGATIVE-01",
    "GOLDEN-AMZ-ADS-NEGATIVE-02",
    "GOLDEN-AMZ-ADS-NEGATIVE-03",
    "GOLDEN-AMZ-ADS-NEGATIVE-04",
    "GOLDEN-AMZ-ADS-NEGATIVE-05",
    "GOLDEN-AMZ-ADS-NEGATIVE-06",
    "GOLDEN-AMZ-ADS-NEGATIVE-07",
    "GOLDEN-AMZ-ADS-NEGATIVE-08",
    "GOLDEN-AMZ-ADS-ADVERSARIAL-01",
    "GOLDEN-AMZ-ADS-ADVERSARIAL-02",
    "GOLDEN-AMZ-ADS-ADVERSARIAL-03",
    "GOLDEN-AMZ-ADS-ADVERSARIAL-04"
  ],
  "relationIds": [
    "REL-EVID-SUPPORTS-CLAIM",
    "REL-CLAIM-DEFINES-METRIC",
    "REL-DECISION-USES-METRIC",
    "REL-PLAYBOOK-IMPLEMENTS-DECISION",
    "REL-SKILL-IMPLEMENTS-PLAYBOOK",
    "REL-TASK-M1B-IMPLEMENTS-SKILL",
    "REL-TASK-M1B-VALIDATED-EVAL"
  ],
  "canonicalization": "sorted-object-and-relation-ids-v1",
  "manifestHash": "sha256:cfa7d24c4116807a3a885ee0f860bf33720de494c50e934a5e23f6fb5a6b4240",
  "createdAt": "2026-08-09T00:00:00Z",
  "immutable": true
}
